{
  "schema": "system_compiler.front_page_entry_runtime_session_opening_flow_plan_action/v0",
  "kind": "system_compiler.front_page_entry_runtime_session_opening_flow_plan_action",
  "generated_at_utc": "2026-05-05T00:00:00Z",
  "generator": "scripts/export_system_compiler_front_page_entry_runtime_session_opening_flow_plan_action.py",
  "result": "ok",
  "runtime_session_opening_flow_plan_action": {
    "title": "System Compiler Front Page Entry Runtime Session Opening Flow Plan Action",
    "summary": "A narrow runtime-session bridge that projects inspect compare consumer judgment into one opening-flow action."
  },
  "front_page": {
    "summary_path": "/tmp/front-page.entry-runtime-session-opening-flow.plan-action.summary.json",
    "report_markdown_path": "/tmp/front-page.entry-runtime-session-opening-flow.plan-action.report.md",
    "check_text_path": "/tmp/front-page.entry-runtime-session-opening-flow.plan-action.check.txt",
    "supporting_surfaces": [
      {
        "id": "source_consumer_summary",
        "label": "source runtime-session inspect compare consumer",
        "role": "source_consumer_summary",
        "summary_schema": "minimal_kernel.runtime_session_witness_inspect_compare_consumer/v0",
        "summary_path": "/tmp/session-witness.inspect.compare.consumer.summary.json",
        "report_markdown_path": "/tmp/session-witness.inspect.compare.consumer.report.md",
        "check_text_path": "/tmp/session-witness.inspect.compare.consumer.check.txt"
      }
    ]
  },
  "artifact_context": {
    "source_consumer_summary_path": "/tmp/session-witness.inspect.compare.consumer.summary.json",
    "output_root": "/tmp",
    "bridge_summary_path": "/tmp/front-page.entry-runtime-session-opening-flow.plan-action.summary.json",
    "report_markdown_path": "/tmp/front-page.entry-runtime-session-opening-flow.plan-action.report.md",
    "check_text_path": "/tmp/front-page.entry-runtime-session-opening-flow.plan-action.check.txt"
  },
  "source_consumer": {
    "result": "ok",
    "source_compare": {
      "changed": true,
      "summary_path": "/tmp/session-witness.inspect.compare.summary.json"
    },
    "default_focus_id": "session-state-drift",
    "default_focus_kind": "session_state_drift",
    "default_focus_severity": "critical",
    "default_explain_hop_id": "session-state-drift-hop",
    "default_explain_hop_reason_kind": "session_report"
  },
  "judgment_inputs": {
    "consumer_summary_ref": {
      "id": "consumer-summary",
      "label": "runtime-session inspect compare consumer summary",
      "ref_kind": "consumer_summary",
      "path": "/tmp/session-witness.inspect.compare.consumer.summary.json",
      "summary_schema": "minimal_kernel.runtime_session_witness_inspect_compare_consumer/v0",
      "summary_kind": "minimal_kernel.runtime_session_witness_inspect_compare_consumer"
    },
    "default_focus_ref": {
      "id": "session-state-drift",
      "label": "Session state drifted standing -> collapsed",
      "ref_kind": "default_focus",
      "path": "/tmp/session-witness.inspect.compare.consumer.summary.json",
      "focus_kind": "session_state_drift",
      "severity": "critical"
    },
    "selected_explain_hop_ref": {
      "id": "session-state-drift-hop",
      "label": "Session state drifted standing -> collapsed",
      "ref_kind": "default_explain_hop",
      "path": "/tmp/session-witness.inspect.compare.consumer.summary.json",
      "reason_kind": "session_report"
    },
    "selected_artifact_ref": {
      "id": "session-report",
      "label": "kernel runtime session report",
      "ref_kind": "artifact_ref",
      "path": "/tmp/session/report.md"
    },
    "fallback_artifact_refs": [
      {
        "id": "session-summary",
        "label": "kernel runtime session summary",
        "ref_kind": "fallback_artifact_ref",
        "path": "/tmp/session/kernel_runtime_session.summary.json"
      }
    ]
  },
  "facade_surface": {
    "id": "runtime_session_consumer_facade",
    "label": "runtime-session inspect compare consumer facade",
    "role": "runtime_session_consumer_facade",
    "summary_schema": "minimal_kernel.runtime_session_witness_inspect_compare_consumer/v0",
    "summary_path": "/tmp/session-witness.inspect.compare.consumer.summary.json",
    "report_markdown_path": "/tmp/session-witness.inspect.compare.consumer.report.md",
    "check_text_path": "/tmp/session-witness.inspect.compare.consumer.check.txt"
  },
  "artifact_target": {
    "selected_artifact_ref": {
      "id": "session-report",
      "label": "kernel runtime session report",
      "ref_kind": "artifact_ref",
      "path": "/tmp/session/report.md"
    },
    "fallback_artifact_refs": [
      {
        "id": "session-summary",
        "label": "kernel runtime session summary",
        "ref_kind": "fallback_artifact_ref",
        "path": "/tmp/session/kernel_runtime_session.summary.json"
      }
    ]
  },
  "open_action": {
    "status": "ready",
    "action_id": "open-default",
    "action_kind": "default",
    "entry_name": "runtime-session-inspect-consumer",
    "selected_tab_id": "runtime_session",
    "selected_role": "runtime_session_opening",
    "query_kind": "default_overview",
    "query_scope": "artifact_root",
    "projection_kind": "kernel_runtime_session_opening_judgment",
    "expected_consumer_operation": "open-consumer-summary",
    "opening_reason": {
      "kind": "route",
      "summary": "由 inspect compare consumer 的 default focus/default explain hop 决定本次 opening",
      "source_summary_path": "/tmp/session-witness.inspect.compare.consumer.summary.json",
      "drift_changed": true,
      "drift_verdict": "drifted"
    },
    "blockers": []
  },
  "opening_preview": {
    "available": true,
    "entry_name": "runtime-session-inspect-consumer",
    "projection_kind": "kernel_runtime_session_opening_judgment",
    "headline": "Session state drifted standing -> collapsed",
    "summary_lines": [
      "result ok -> fail"
    ],
    "question_lines": [
      "Did the session collapse before runtime continuity recovered?"
    ],
    "line_count": 1,
    "question_count": 1,
    "blockers": []
  },
  "execution_receipt": {
    "chosen_by": "default_focus/default_explain_hop",
    "planned_action_count": 1,
    "consumer_operation": "open-consumer-summary"
  },
  "questions": {
    "bridge_questions": [
      "Should the runtime-session opening judgment open the inspect compare consumer facade before deeper artifact targets?"
    ],
    "next_questions": [
      "Should the selected artifact target become the next explain surface only after the consumer facade is visible?"
    ]
  },
  "violations": []
}
